{
  "identity": {
    "name": "Shaun Alonzo",
    "initials": "SA",
    "role": "Senior .NET & AWS Engineer",
    "email": "contact@shaunalonzo.com",
    "url": "https://shaunalonzo.com",
    "location": {
      "city": "Manila",
      "country": "Philippines",
      "timezone": "UTC+8"
    },
    "image": {
      "src": "assets/shaunalonzo.jpg",
      "alt": "{name}"
    },
    "favicon": "favicon.ico"
  },
  "metadata": {
    "language": "en",
    "title": "{name} — {role}",
    "description": "Senior .NET & AWS engineer available for contract, consulting, and full-time roles. .NET modernization, AWS architecture, and AI-augmented engineering. Remote, Philippines-based.",
    "openGraphDescription": "Senior .NET & AWS engineer available for contract, consulting, and full-time roles. .NET modernization, AWS architecture, and AI-augmented engineering.",
    "openGraphType": "website",
    "twitterCard": "summary",
    "twitterDescription": "Senior .NET & AWS engineer available for contract, consulting, and full-time roles.",
    "knowsAbout": [".NET", "C#", "AWS", "React", "TypeScript", "Microservices", "Event-Driven Architecture", "AI-Augmented Development"]
  },
  "navigation": [
    { "id": "about", "route": "/about", "label": "About" },
    { "id": "services", "route": "/services", "label": "Services" },
    { "id": "skills", "route": "/skills", "label": "Skills" },
    { "id": "experience", "route": "/experience", "label": "Experience" },
    { "id": "projects", "route": "/projects", "label": "Projects" },
    { "id": "contact", "route": "/contact", "label": "Contact" }
  ],
  "ui": {
    "themeToggle": "Toggle dark/light mode",
    "switchToDark": "Switch to dark mode",
    "switchToLight": "Switch to light mode",
    "openMenu": "Open navigation menu",
    "closeMenu": "Close navigation menu",
    "alsoUsed": "Also used",
    "bestFor": "Best for:",
    "email": "Email Me",
    "copyEmail": "Copy Email",
    "copyEmailLabel": "Copy email address",
    "copySuccess": "Copied!",
    "copyError": "Unable to copy. Please copy the email address manually.",
    "openChat": "Open chat",
    "closeChat": "Close chat",
    "chatTitle": "Chat with {firstName}'s Assistant",
    "chatPlaceholder": "Type a message...",
    "chatInputLabel": "Type a message",
    "sendMessage": "Send message"
  },
  "hero": {
    "greeting": "Hello, I'm",
    "description": "I help engineering teams modernize legacy .NET systems, design cloud-native architectures on AWS, and ship with AI-augmented workflows. 10+ years building for fintech, real estate, and marketplace platforms across APAC and Australia.",
    "cta": { "target": "contact", "label": "Get In Touch" },
    "next": { "target": "services", "label": "How I Can Help" }
  },
  "services": {
    "title": "How I Can Help Your Team",
    "items": [
      {
        "icon": "fas fa-sync-alt",
        "title": ".NET Modernization",
        "description": "Move legacy .NET Framework workloads from Windows EC2 to containerized .NET on AWS without disrupting customers.",
        "fit": "teams carrying risky legacy services, slow release cycles, or unsupported framework versions.",
        "proof": [
          "Phased traffic routing and .NET Standard compatibility bridges",
          "5+ years of technical debt eliminated with zero customer impact"
        ],
        "outcome": "Outcome: safer releases, clearer ownership, and a platform ready for modern AWS operations."
      },
      {
        "icon": "fas fa-cloud",
        "title": "AWS Architecture & Cloud-Native Design",
        "description": "Design event-driven, serverless, and containerized AWS systems that match the team’s operating model.",
        "fit": "product teams moving beyond lift-and-shift cloud hosting.",
        "proof": [
          "SQS/SNS, EventBridge, Lambda, API Gateway, ECS Fargate, EKS, and AWS CDK",
          "AWS Solutions Architect Associate certified"
        ],
        "outcome": "Outcome: cloud architecture that is observable, resilient, and easier to change."
      },
      {
        "icon": "fas fa-robot",
        "title": "AI-Augmented Engineering",
        "description": "Help teams use Claude Code and GitHub Copilot responsibly across architecture, coding, tests, and reviews.",
        "fit": "teams that want AI speed without weakening engineering judgment or review quality.",
        "proof": [
          "AI practices established across architecture, code generation, and automated testing",
          "Best practices later adopted by multiple squads at Domain"
        ],
        "outcome": "Outcome: faster delivery loops with clearer guardrails for quality and maintainability."
      },
      {
        "icon": "fas fa-user-tie",
        "title": "Fractional Senior/Principal Engineer",
        "description": "Add senior .NET/AWS judgment to a critical project without waiting for a full-time hire.",
        "fit": "3-6 month modernization, architecture, delivery, or mentoring gaps.",
        "proof": [
          "Remote delivery across APAC, Australia, UK, and US time zones",
          "Architecture leadership, mentoring, implementation, and delivery support"
        ],
        "outcome": "Outcome: a critical project gets senior ownership while your team keeps moving."
      }
    ],
    "next": { "target": "skills", "label": "View Skills" }
  },
  "skills": {
    "title": "Skills",
    "intro": "System design, .NET modernization, and AI-augmented engineering, supported by cloud, backend, data, and frontend skills.",
    "categories": [
      {
        "title": "Signature capabilities",
        "description": "The areas where I bring the most senior-level ownership to modernization and delivery work.",
        "primary": true,
        "items": [".NET 10", "AWS", "System Design", "AI-Augmented Engineering", "Claude Code"],
        "more": []
      },
      {
        "title": "Backend",
        "description": "Build .NET services and APIs, from application architecture to data access.",
        "primary": false,
        "items": ["C#", ".NET 10", "ASP.NET Core", "REST APIs", "CQRS", "Microservices"],
        "more": ["Entity Framework", "Dapper"]
      },
      {
        "title": "Cloud & delivery",
        "description": "Deploy applications and connect services using AWS and Azure.",
        "primary": false,
        "items": ["ECS Fargate", "EKS", "Lambda", "SQS/SNS", "EventBridge", "Azure App Service", "Azure Functions", "Azure Service Bus"],
        "more": ["API Gateway", "S3", "DynamoDB", "CDK"]
      },
      {
        "title": "Data & caching",
        "description": "Store, query, and cache application data.",
        "primary": false,
        "items": ["SQL Server", "PostgreSQL", "Redis", "DynamoDB", "Query Optimization"],
        "more": []
      },
      {
        "title": "AI-augmented engineering",
        "description": "Integrate AI tools into architecture, coding, testing, and code review.",
        "primary": false,
        "items": ["Claude Code", "GitHub Copilot"],
        "more": ["MCP Architecture", "Prompt Engineering", "LLM API Integration"]
      },
      {
        "title": "DevOps, testing & observability",
        "description": "Automate deployments, test user journeys, and diagnose production issues.",
        "primary": false,
        "items": ["Docker", "GitHub Actions", "ArgoCD", "xUnit", "Playwright"],
        "more": ["CloudWatch", "Serilog", "Elastic APM"]
      },
      {
        "title": "Frontend",
        "description": "Build web and mobile interfaces backed by .NET services.",
        "primary": false,
        "items": ["React", "TypeScript", "Angular", "Server-Side Rendering", "Server-Driven UI", "Responsive Design"],
        "more": []
      }
    ],
    "next": { "target": "experience", "label": "See Experience" }
  },
  "experience": {
    "title": "Work Experience",
    "items": [
      {
        "date": "Mar 2023 - Present",
        "company": "Domain",
        "url": "https://www.domain.com.au",
        "position": "Senior Software Engineer — Remote",
        "highlights": [
          "Led zero-downtime modernization of mission-critical services from .NET Framework on AWS EC2 (Windows) to containerized .NET on AWS EKS, eliminating 5+ years of technical debt with zero customer impact.",
          "Architected an event-driven Order Orchestration Engine using AWS EventBridge, SNS, and SQS to automate Salesforce order ingestion — eliminating manual steps from the sales pipeline and accelerating order processing.",
          "Built a reusable .NET HTTP resilience library with IHttpClientFactory, automated OAuth2 token lifecycle, and configurable circuit breakers/retries — adopted across multiple squads.",
          "Integrated Claude Code & GitHub Copilot into the full SDLC (architecture, coding, test generation, code review), measurably increasing team throughput sprint-over-sprint. Established AI tooling best practices later adopted across the organization.",
          "Migrated legacy React/.NET Framework internal tools to Retool (no-code), freeing engineering capacity from internal CRUD maintenance to focus on core revenue-generating products.",
          "Introduced end-to-end automated testing with Playwright in the build pipeline, validating critical frontend and backend user journeys on every deployment."
        ]
      },
      {
        "date": "Nov 2021 - Mar 2023",
        "company": "Carsales",
        "url": "https://www.carsales.com.au",
        "position": "Senior Software Engineer — Remote",
        "highlights": [
          "Engineered a standardized Server-Driven UI (SDUI) framework for Editorial and Reviews pages, establishing a unified contract across Web, iOS, and Android — decoupling cross-team dependencies and reducing time-to-market.",
          "Decomposed a monolithic Editorial API into separate read/write paths with Redis distributed caching (CQRS), improving scalability for consuming teams.",